{"attempts":[{"assessment":{"assertions":[],"status":"NOT_RUN"},"corpus_id":"G05-001","divergences":[{"classification":"COVERAGE_GAP","expected_in_ground_truth":true,"layer":"SEMANTICS","reason":"MICA_ENTITY_CLASS_ROUTE_REQUIRES_H1_H2_MAPPING"}],"fetch":{"bytes":167321,"mode":"LOCAL_SNAPSHOT","sha256":"0af299b12a3086e336cf6eaded8db9fee0db6a501b84b8d04467305b38a51a9a","snapshot_file":"raw/h7-esma-casps.csv","status":"FETCH_OK"},"ground_truth":{"expected_contract_risks":["COVERAGE_GAP"],"expected_facts":[{"fact":"home_state_ES","observed":true},{"fact":"lei_present","observed":true},{"fact":"services_present","observed":true}],"expected_source_presence":["ESMA_MICA_REGISTER"],"identity_join_expected":null,"status":"MATCH"},"identity":{"cross_source_join":"NOT_APPLICABLE","identifier":"K8MS7FD7N5Z2WQ51AZ71","identifier_diagnostic":"VALID","identifier_kind":"LEI","identifier_valid":true,"legal_name_match":true,"status":"EXACT_IDENTIFIER"},"legal_name":"Banco Bilbao Vizcaya Argentaria S.A.","parse":{"parser":"EsmaCaspsAdapter","record":{"observed":{"authorisation_end_date":null,"authorisation_notification_date":"05/03/2025","commercial_name":"BBVA","competent_authority":"Comision Nacional del Mercado de Valores (CNMV)","home_member_state":"ES","last_update":"07/03/2026","legal_name":"Banco Bilbao Vizcaya Argentaria S.A.","lei":"K8MS7FD7N5Z2WQ51AZ71","lei_diagnostic":"VALID","lei_valid":true,"service_codes_raw":"a. providing custody and administration of crypto-assets on behalf of clients.|e. execution of orders for crypto-assets on behalf of clients.|j. providing transfer services for crypto-assets on behalf of clients.","service_countries_raw":"ES"},"raw_record":{"":"","ac_authorisationEndDate":"","ac_authorisationNotificationDate":"05/03/2025","ac_comments":"","ac_lastupdate":"07/03/2026","ac_serviceCode":"a. providing custody and administration of crypto-assets on behalf of clients.|e. execution of orders for crypto-assets on behalf of clients.|j. providing transfer services for crypto-assets on behalf of clients.","ac_serviceCode_cou":"ES","ae_address":"Plaza San Nicolas 4. 48005 Bilbao (Vizcaya).","ae_commercial_name":"BBVA","ae_competentAuthority":"Comision Nacional del Mercado de Valores (CNMV)","ae_homeMemberState":"ES","ae_lei":"K8MS7FD7N5Z2WQ51AZ71","ae_lei_cou_code":"ES","ae_lei_name":"Banco Bilbao Vizcaya Argentaria S.A.","ae_website":"www.bbva.es","ae_website_platform":""},"raw_record_sha256":"bbcbdcd039b006c12d561407ef161abeb7375b492333b9ded99daf7d276739f1","record_key":{"field":"ae_lei","value":"K8MS7FD7N5Z2WQ51AZ71"},"source":"ESMA_MICA_REGISTER"},"record_found":true,"status":"PARSE_OK"},"pre_registered_contract_risks":["COVERAGE_GAP"],"semantics":{"assertion_created":false,"assessment":"NOT_RUN","entry_mechanism":null,"legal_effect":null,"raw_dimensions_preserved":["authorisation_notification_date","authorisation_end_date","service_codes_raw","service_countries_raw"],"reason":"ENTRY_ROUTE_AND_ENTITY_CLASS_NOT_INFERRED_FROM_CSV_ROW","status":"RAW_FACTS_ONLY","territorial_basis":null},"snapshot_file":"raw/h7-esma-casps.csv","source":"ESMA_MICA_REGISTER","source_record_key":{"field":"ae_lei","value":"K8MS7FD7N5Z2WQ51AZ71"},"source_snapshot_sha":"0af299b12a3086e336cf6eaded8db9fee0db6a501b84b8d04467305b38a51a9a"},{"assessment":{"assertions":[],"status":"NOT_RUN"},"corpus_id":"G05-002","divergences":[{"classification":"COVERAGE_GAP","expected_in_ground_truth":true,"layer":"SEMANTICS","reason":"MICA_ENTITY_CLASS_ROUTE_REQUIRES_H1_H2_MAPPING"}],"fetch":{"bytes":167321,"mode":"LOCAL_SNAPSHOT","sha256":"0af299b12a3086e336cf6eaded8db9fee0db6a501b84b8d04467305b38a51a9a","snapshot_file":"raw/h7-esma-casps.csv","status":"FETCH_OK"},"ground_truth":{"expected_contract_risks":["COVERAGE_GAP"],"expected_facts":[{"fact":"home_state_ES","observed":true},{"fact":"lei_present","observed":true},{"fact":"services_present","observed":true}],"expected_source_presence":["ESMA_MICA_REGISTER"],"identity_join_expected":null,"status":"MATCH"},"identity":{"cross_source_join":"NOT_APPLICABLE","identifier":"5493000LM0MZ4JPMGM90","identifier_diagnostic":"VALID","identifier_kind":"LEI","identifier_valid":true,"legal_name_match":true,"status":"EXACT_IDENTIFIER"},"legal_name":"OPEN BANK S.A.","parse":{"parser":"EsmaCaspsAdapter","record":{"observed":{"authorisation_end_date":null,"authorisation_notification_date":"24/07/2025","commercial_name":"OPENBANK","competent_authority":"Comision Nacional del Mercado de Valores (CNMV)","home_member_state":"ES","last_update":"14/05/2026","legal_name":"OPEN BANK S.A.","lei":"5493000LM0MZ4JPMGM90","lei_diagnostic":"VALID","lei_valid":true,"service_codes_raw":"a. providing custody and administration of crypto-assets on behalf of clients.|e. execution of orders for crypto-assets on behalf of clients.","service_countries_raw":"ES|DE"},"raw_record":{"":"","ac_authorisationEndDate":"","ac_authorisationNotificationDate":"24/07/2025","ac_comments":"","ac_lastupdate":"14/05/2026","ac_serviceCode":"a. providing custody and administration of crypto-assets on behalf of clients.|e. execution of orders for crypto-assets on behalf of clients.","ac_serviceCode_cou":"ES|DE","ae_address":"Avenida de Cantabria s/n. 28660 Boadilla del Monte (Madrid).","ae_commercial_name":"OPENBANK","ae_competentAuthority":"Comision Nacional del Mercado de Valores (CNMV)","ae_homeMemberState":"ES","ae_lei":"5493000LM0MZ4JPMGM90","ae_lei_cou_code":"ES","ae_lei_name":"OPEN BANK S.A.","ae_website":"www.openbank.es","ae_website_platform":""},"raw_record_sha256":"c5059dfc836fc8326546a2acb496a8ac58bbccdb4ad225b99228e7b5b29e83c5","record_key":{"field":"ae_lei","value":"5493000LM0MZ4JPMGM90"},"source":"ESMA_MICA_REGISTER"},"record_found":true,"status":"PARSE_OK"},"pre_registered_contract_risks":["COVERAGE_GAP"],"semantics":{"assertion_created":false,"assessment":"NOT_RUN","entry_mechanism":null,"legal_effect":null,"raw_dimensions_preserved":["authorisation_notification_date","authorisation_end_date","service_codes_raw","service_countries_raw"],"reason":"ENTRY_ROUTE_AND_ENTITY_CLASS_NOT_INFERRED_FROM_CSV_ROW","status":"RAW_FACTS_ONLY","territorial_basis":null},"snapshot_file":"raw/h7-esma-casps.csv","source":"ESMA_MICA_REGISTER","source_record_key":{"field":"ae_lei","value":"5493000LM0MZ4JPMGM90"},"source_snapshot_sha":"0af299b12a3086e336cf6eaded8db9fee0db6a501b84b8d04467305b38a51a9a"},{"assessment":{"assertions":[],"status":"NOT_RUN"},"corpus_id":"G05-003","divergences":[{"classification":"COVERAGE_GAP","expected_in_ground_truth":true,"layer":"SEMANTICS","reason":"MICA_ENTITY_CLASS_ROUTE_REQUIRES_H1_H2_MAPPING"}],"fetch":{"bytes":167321,"mode":"LOCAL_SNAPSHOT","sha256":"0af299b12a3086e336cf6eaded8db9fee0db6a501b84b8d04467305b38a51a9a","snapshot_file":"raw/h7-esma-casps.csv","status":"FETCH_OK"},"ground_truth":{"expected_contract_risks":["COVERAGE_GAP"],"expected_facts":[{"fact":"home_state_ES","observed":true},{"fact":"lei_present","observed":true},{"fact":"services_present","observed":true}],"expected_source_presence":["ESMA_MICA_REGISTER"],"identity_join_expected":null,"status":"MATCH"},"identity":{"cross_source_join":"NOT_APPLICABLE","identifier":"549300CQ9NLEHMRCU505","identifier_diagnostic":"VALID","identifier_kind":"LEI","identifier_valid":true,"legal_name_match":true,"status":"EXACT_IDENTIFIER"},"legal_name":"CECABANK S.A.","parse":{"parser":"EsmaCaspsAdapter","record":{"observed":{"authorisation_end_date":null,"authorisation_notification_date":"24/07/2025","commercial_name":"CECABANK","competent_authority":"Comision Nacional del Mercado de Valores (CNMV)","home_member_state":"ES","last_update":"07/08/2025","legal_name":"CECABANK S.A.","lei":"549300CQ9NLEHMRCU505","lei_diagnostic":"VALID","lei_valid":true,"service_codes_raw":"a. providing custody and administration of crypto-assets on behalf of clients.|g. reception and transmission of orders for crypto-assets on behalf of clients.|j. providing transfer services for crypto-assets on behalf of clients.","service_countries_raw":"ES"},"raw_record":{"":"","ac_authorisationEndDate":"","ac_authorisationNotificationDate":"24/07/2025","ac_comments":"","ac_lastupdate":"07/08/2025","ac_serviceCode":"a. providing custody and administration of crypto-assets on behalf of clients.|g. reception and transmission of orders for crypto-assets on behalf of clients.|j. providing transfer services for crypto-assets on behalf of clients.","ac_serviceCode_cou":"ES","ae_address":"C/Alcala 27 28014 Madrid.","ae_commercial_name":"CECABANK","ae_competentAuthority":"Comision Nacional del Mercado de Valores (CNMV)","ae_homeMemberState":"ES","ae_lei":"549300CQ9NLEHMRCU505","ae_lei_cou_code":"ES","ae_lei_name":"CECABANK S.A.","ae_website":"www.cecabank.es","ae_website_platform":""},"raw_record_sha256":"1aa963c9004e538819c563428411e8ca0f7a12512538c2bbb2dbad53bcd0c1f9","record_key":{"field":"ae_lei","value":"549300CQ9NLEHMRCU505"},"source":"ESMA_MICA_REGISTER"},"record_found":true,"status":"PARSE_OK"},"pre_registered_contract_risks":["COVERAGE_GAP"],"semantics":{"assertion_created":false,"assessment":"NOT_RUN","entry_mechanism":null,"legal_effect":null,"raw_dimensions_preserved":["authorisation_notification_date","authorisation_end_date","service_codes_raw","service_countries_raw"],"reason":"ENTRY_ROUTE_AND_ENTITY_CLASS_NOT_INFERRED_FROM_CSV_ROW","status":"RAW_FACTS_ONLY","territorial_basis":null},"snapshot_file":"raw/h7-esma-casps.csv","source":"ESMA_MICA_REGISTER","source_record_key":{"field":"ae_lei","value":"549300CQ9NLEHMRCU505"},"source_snapshot_sha":"0af299b12a3086e336cf6eaded8db9fee0db6a501b84b8d04467305b38a51a9a"},{"assessment":{"assertions":[],"status":"NOT_RUN"},"corpus_id":"G05-004","divergences":[{"classification":"COVERAGE_GAP","expected_in_ground_truth":false,"layer":"SEMANTICS","reason":"MICA_ENTITY_CLASS_ROUTE_REQUIRES_H1_H2_MAPPING"}],"fetch":{"bytes":167321,"mode":"LOCAL_SNAPSHOT","sha256":"0af299b12a3086e336cf6eaded8db9fee0db6a501b84b8d04467305b38a51a9a","snapshot_file":"raw/h7-esma-casps.csv","sta